"targets","layer","layer_old","name","description","citation_nature2012","citation_plos2013","fld_value","units","dir_2013a","fn_2013a","filename"
"resilience","species_diversity","species_diversity","Ocean ecological integrity","Marine species diversity as a proxy for ecological integrity: ocean","7.18","5.18","score","resilience score","neptune_data:model/GL-NCEAS-SpeciesDiversity_v2013a/data","rgn_spp_score_2013.csv","species_diversity_global2013.csv"
"resilience","species_diversity_3nm","species_diversity_3nm","Coastal ecological integrity","Marine species diversity as a proxy for ecological integrity: coastal","7.18","5.18","score","resilience score","neptune_data:model/GL-NCEAS-SpeciesDiversity_v2013a/data","rgn_spp_score_offshore3nm_2013.csv","species_diversity_3nm_global2013.csv"
"resilience","tourism","tourism","CBD survey: tourism","Convention on Biological Diversity (CBD) Third National Survey questions in 2005","7.14","5.14","resilience score","resilience score","neptune_data:model/GL-NCEAS-Resilience_v2013a/data","r_tourism_2013a.csv","tourism_global2013.csv"
"resilience","water","water","CBD survey: water","Convention on Biological Diversity (CBD) Third National Survey questions in 2005","7.14","5.14","resilience score","resilience score","neptune_data:model/GL-NCEAS-Resilience_v2013a/data","r_water_2013a.csv","water_global2013.csv"
"resilience","wgi_all","wgi_all","Strength of governance indicated with the WGI","World Governance Indicators (WGI) six combined scores","7.7","5.77","score","resilience score","neptune_data:model/GL-WorldBank-WGI_v2011/data","rgn_wb_wgi_2013a_rescaled.csv","wgi_all_global2013.csv"
"spatial","cntry_georegions","cnk_cntry_georegions","Georegion ids per country, at 3 georegion levels","georegions per country, at 3 georegion levels","3",,"georgn_id","georegion id","neptune_data:model/GL-NCEAS-OceanRegions_v2013a/manual_output","cntry_georegions_long_2013b.csv","cntry_georegions_global2013.csv"
"spatial","cntry_rgn","cn_cntry_rgn","Regions per country","regions per country","3",,"rgn_id","region id","neptune_data:model/GL-NCEAS-OceanRegions_v2013a/manual_output","cntry_rgn_2013.csv","cntry_rgn_global2013.csv"
"spatial","rgn_area","rn_rgn_area","Region area of total EEZ ocean","region in water area","3",,"area_km2","km^2","neptune_data:model/GL-NCEAS-OceanRegions_v2013a/data","rgn_fao_gcs_area.csv","rgn_area_global2013.csv"
"spatial","rgn_area_inland1km","rn_rgn_area_inland1km","Region area 1 km inland","inland area 1 km from shore","3",,"area_km2","km^2","neptune_data:model/GL-NCEAS-OceanRegions_v2013a/data","rgn_area_inland1km.csv","rgn_area_inland1km_global2013.csv"
"spatial","rgn_area_offshore3nm","rn_rgn_area_offshore3nm","Region area offshore 3nm","offshore area 3 nautical miles from shore","3",,"area_km2","km^2","neptune_data:model/GL-NCEAS-OceanRegions_v2013a/data","rgn_area_offshore3nm.csv","rgn_area_offshore3nm_global2013.csv"
"spatial","rgn_georegion_labels","rtk_rgn_georegion_labels","Georegion labels per region, at 3 georegion levels","georegions per region, at 3 georegion levels","3",,"label","label","neptune_data:model/GL-NCEAS-OceanRegions_v2013a/manual_output","rgn_georegions_labels_long_2013b.csv","rgn_georegion_labels_global2013.csv"
"spatial","rgn_georegions","rnk_rgn_georegions","Georegion ids per region, at 3 georegion levels","georegions per region, at 3 georegion levels","3",,"georgn_id","georegion id","neptune_data:model/GL-NCEAS-OceanRegions_v2013a/manual_output","rgn_georegions_long_2013b.csv","rgn_georegions_global2013.csv"
"spatial","rgn_global","rnk_rgn_global","regions used in global analysis for Nature 2012, subset of regions_labels by type=eez and not deleted or disputed ","regions used in global analysis for Nature 2012, subset of regions_labels by type=eez and not deleted or disputed ","3",,"label","label","neptune_data:model/GL-NCEAS-OceanRegions_v2013a/data","rgn_global.csv","rgn_global_global2013.csv"
"spatial","rgn_labels","rtk_rgn_labels","regions by type (eez, subocean, unclaimed) and label","regions by type (eez, subocean, unclaimed) and label","3",,"label","label","neptune_data:model/GL-NCEAS-OceanRegions_v2013a/data","rgn_labels.csv","rgn_labels_global2013.csv"
"SPP","spp_status","rn_spp_status","Species lists and IUCN threat categories as a proxy for iconic species status","International Union for Conservation of Nature (IUCN) Red List threat categories with aggregated species lists ","7.27","5.29","score","status score","neptune_data:model/GL-NCEAS-SpeciesDiversity_v2013a/data","rgn_spp_score_2013.csv","spp_status_global2013.csv"
"SPP","spp_trend","rn_spp_trend","Species lists and IUCN threat categories as a proxy for iconic species trend","International Union for Conservation of Nature (IUCN) Red List threat categories with aggregated species lists ","7.27","5.29","score","trend score","neptune_data:model/GL-NCEAS-SpeciesDiversity_v2013a/data","rgn_spp_trend_2013.csv","spp_trend_global2013.csv"
"TR","tr_jobs_total","tr_jobs_total","Total labor force",,,,"count","jobs","neptune_data:model/GL-WorldBank-Statistics_v2012/data","rgn_wb_lab_2013a_avgduplicates.csv","tr_jobs_total_global2013.csv"
"TR","tr_jobs_tourism","tr_jobs_tourism","Direct employment in tourism",,,,"count","jobs","neptune_data:model/GL-WTTC-Tourism_v2011/data","rgn_wttc_empd_2013a_avgduplicates.csv","tr_jobs_tourism_global2013.csv"
"TR","tr_sustainability","tr_sustainability","Sustainability index","Tourism Competitiveness Index (TTCI) from the World Economic Forum",,,"score","score","neptune_data:model/GL-WEF-Economics_v2013/data","rgn_wef_ttci_2013a_lyr.csv","tr_sustainability_global2013.csv"
"TR","tr_unemployment","tr_unemployment","Percent unemployment",,,,"percent","percent unemployed","neptune_data:model/GL-WorldBank-Statistics_v2012/data","rgn_wb_uem_2013a_avgduplicates.csv","tr_unemployment_global2013.csv"
